{
  "asset": {
    "asset_id": "ubuntu-vm-01",
    "hostname": "vm",
    "os_release": {
      "id": "ubuntu",
      "pretty_name": "Ubuntu 24.04.5 LTS",
      "version_id": "24.04"
    }
  },
  "checks": {
    "FILE-001": {
      "check_id": "FILE-001",
      "collected_at": "2026-10-17T12:03:52Z",
      "collector_status": "OK",
      "errors": [],
      "evidence": {
        "files": {
          "/etc/group": {
            "exists": true,
            "gid": 0,
            "group": "root",
            "is_regular": true,
            "mode": 420,
            "mode_octal": "0644",
            "owner": "root",
            "uid": 0
          },
          "/etc/gshadow": {
            "exists": true,
            "gid": 42,
            "group": "shadow",
            "is_regular": true,
            "mode": 416,
            "mode_octal": "0640",
            "owner": "root",
            "uid": 0
          },
          "/etc/passwd": {
            "exists": true,
            "gid": 0,
            "group": "root",
            "is_regular": true,
            "mode": 420,
            "mode_octal": "0644",
            "owner": "root",
            "uid": 0
          },
          "/etc/shadow": {
            "exists": true,
            "gid": 42,
            "group": "shadow",
            "is_regular": true,
            "mode": 416,
            "mode_octal": "0640",
            "owner": "root",
            "uid": 0
          }
        }
      },
      "limitations": [],
      "sources": [
        "stat /etc/group",
        "stat /etc/gshadow",
        "stat /etc/passwd",
        "stat /etc/shadow"
      ],
      "title": "Account database file permissions and ownership"
    },
    "FW-001": {
      "check_id": "FW-001",
      "collected_at": "2026-10-17T12:03:52Z",
      "collector_status": "OK",
      "errors": [],
      "evidence": {
        "active": false,
        "default_incoming": null,
        "default_outgoing": null,
        "firewall_tool": "ufw",
        "installed": false,
        "method": "not_installed",
        "rule_count": null,
        "rules": []
      },
      "limitations": [
        "Only UFW is evaluated; nftables/iptables-only setups are not recognised."
      ],
      "sources": [
        "ufw binary/config absence"
      ],
      "title": "Host firewall (UFW) active with default-deny inbound"
    },
    "LOCK-001": {
      "check_id": "LOCK-001",
      "collected_at": "2026-10-17T12:03:52Z",
      "collector_status": "OK",
      "errors": [],
      "evidence": {
        "deny": null,
        "even_deny_root": null,
        "fail_interval": null,
        "faillock_account": false,
        "faillock_authfail": false,
        "faillock_preauth": false,
        "pam_tally2_present": false,
        "unlock_time": null,
        "value_origin": {}
      },
      "limitations": [
        "Only the common-auth/common-account stacks are inspected; service-specific PAM files may differ."
      ],
      "sources": [
        "/etc/pam.d/common-account",
        "/etc/pam.d/common-auth"
      ],
      "title": "Account lockout after failed logins (pam_faillock)"
    },
    "PWD-001": {
      "check_id": "PWD-001",
      "collected_at": "2026-10-17T12:03:52Z",
      "collector_status": "OK",
      "errors": [],
      "evidence": {
        "dcredit": null,
        "lcredit": null,
        "minclass": null,
        "minlen": null,
        "ocredit": null,
        "pass_max_days": 99999,
        "pass_min_days": 0,
        "pass_warn_age": 7,
        "pwquality_enabled": false,
        "quality_module": null,
        "ucredit": null,
        "value_origin": {}
      },
      "limitations": [
        "login.defs ageing applies to newly created accounts; existing accounts need 'chage -l' review."
      ],
      "sources": [
        "/etc/login.defs",
        "/etc/pam.d/common-password"
      ],
      "title": "Password quality and ageing requirements"
    },
    "SSH-001": {
      "check_id": "SSH-001",
      "collected_at": "2026-10-17T12:03:52Z",
      "collector_status": "OK",
      "errors": [],
      "evidence": {
        "config_files": [],
        "match_overrides": [],
        "method": "not_installed",
        "permit_root_login": null,
        "sshd_installed": false,
        "value_origin": null
      },
      "limitations": [],
      "sources": [
        "dpkg-query openssh-server"
      ],
      "title": "SSH root login disabled"
    },
    "SSH-002": {
      "check_id": "SSH-002",
      "collected_at": "2026-10-17T12:03:52Z",
      "collector_status": "OK",
      "errors": [],
      "evidence": {
        "config_files": [],
        "kbd_interactive_authentication": null,
        "match_overrides": [],
        "method": "not_installed",
        "password_authentication": null,
        "sshd_installed": false,
        "value_origin": {
          "kbd_interactive_authentication": null,
          "password_authentication": null
        }
      },
      "limitations": [],
      "sources": [
        "dpkg-query openssh-server"
      ],
      "title": "SSH password authentication disabled"
    },
    "SVC-001": {
      "check_id": "SVC-001",
      "collected_at": "2026-10-17T12:03:52Z",
      "collector_status": "PARTIAL",
      "errors": [
        "running units unavailable: System has not been booted with systemd as init system (PID 1). Can't operate.\nFailed to connect to bus: Host is down"
      ],
      "evidence": {
        "enabled_units": [
          "containerd",
          "docker",
          "e2scrub_reap",
          "getty@",
          "postgresql",
          "redis-server",
          "ssl-cert",
          "systemd-pstore"
        ],
        "running_units": null
      },
      "limitations": [
        "Only systemd units are inspected; processes started outside systemd are not detected."
      ],
      "sources": [
        "systemctl list-unit-files (enabled)"
      ],
      "title": "No prohibited network services running or enabled"
    },
    "UPD-001": {
      "check_id": "UPD-001",
      "collected_at": "2026-10-17T12:03:52Z",
      "collector_status": "OK",
      "errors": [],
      "evidence": {
        "allowed_origins": [],
        "method": "apt-config dump",
        "package_installed": false,
        "periodic_enable": 0,
        "security_origin": false,
        "unattended_upgrade": 0,
        "update_package_lists": 0,
        "update_timer_enabled": true,
        "upgrade_timer_active": null,
        "upgrade_timer_enabled": true
      },
      "limitations": [],
      "sources": [
        "apt-config dump",
        "dpkg-query unattended-upgrades",
        "systemctl is-enabled apt-daily-upgrade.timer",
        "systemctl is-enabled apt-daily.timer"
      ],
      "title": "Automatic security updates enabled"
    }
  },
  "collected_at": "2026-10-17T12:03:52Z",
  "collector_version": "rdf-collector-1.0",
  "data_origin": "HOST",
  "policy_params": {
    "file_baseline": {
      "/etc/group": {
        "groups": [
          "root"
        ],
        "max_mode": "0644",
        "owner": "root"
      },
      "/etc/gshadow": {
        "groups": [
          "root",
          "shadow"
        ],
        "max_mode": "0640",
        "owner": "root"
      },
      "/etc/passwd": {
        "groups": [
          "root"
        ],
        "max_mode": "0644",
        "owner": "root"
      },
      "/etc/shadow": {
        "groups": [
          "root",
          "shadow"
        ],
        "max_mode": "0640",
        "owner": "root"
      }
    },
    "firewall_allowed_default_incoming": [
      "deny",
      "reject"
    ],
    "firewall_tool": "ufw",
    "lockout_max_deny": 5,
    "lockout_min_unlock_time": 900,
    "password_max_days": 365,
    "password_min_classes": 3,
    "password_min_days": 1,
    "password_min_length": 14,
    "services_allowlist": [],
    "services_allowlist_mode": false,
    "services_denylist": [
      "telnet",
      "telnetd",
      "inetutils-telnetd",
      "rsh",
      "rlogin",
      "rexec",
      "vsftpd",
      "proftpd",
      "pure-ftpd",
      "tftpd-hpa",
      "xinetd",
      "avahi-daemon",
      "cups",
      "cups-browsed",
      "snmpd",
      "rpcbind",
      "nfs-server",
      "smbd",
      "nmbd",
      "slapd",
      "isc-dhcp-server",
      "squid",
      "dovecot"
    ],
    "ssh_absent_is_compliant": true,
    "ssh_allowed_permit_root_login": [
      "no"
    ],
    "ssh_password_authentication_allowed": false,
    "updates_require_security_origin": true,
    "updates_require_timer": true
  },
  "schema_version": "1.0"
}